{
  "fillPolicy": {"sitePolicies": []},
  "basics": {
    "heightCm": 0,
    "weightKg": 0,
    "homeAddress": "",
    "mailingAddress": "",
    "lifePhotos": [],
    "name": "",
    "resumeFile": {"name": "", "type": "", "size": 0, "dataUrl": ""},
    "label": "",
    "gender": "",
    "birthDate": "",
    "birthPlace": "",
    "studentOrigin": "",
    "healthStatus": "",
    "hasOverseasStudy": "",
    "phone": "",
    "email": "",
    "location": {
      "city": "",
      "address": "",
      "region": {
        "province": "",
        "city": "",
        "district": ""
      }
    },
    "hukou": "",
    "nativePlace": "",
    "nativePlaceDetail": {
      "province": "",
      "city": "",
      "district": ""
    },
    "hukouDetail": {
      "province": "",
      "city": "",
      "district": ""
    },
    "ethnicity": "",
    "nationality": "",
    "maritalStatus": "",
    "politicalStatus": "",
    "partyJoinDate": "",
    "idType": "",
    "idNumber": "",
    "highestDegree": "",
    "summary": "",
    "graduationDate": "",
    "achievements": ""
  },
  "application": {
    "emergencyContactName": "",
    "emergencyContactPhone": "",
    "recruitmentSource": "",
    "recruitmentSourceDetail": "",
    "interviewSite": ""
  },
  "expected": {
    "salary": "",
    "city": "",
    "startDate": "",
    "acceptRelocation": ""
  },
  "profiles": [],
  "education": [
    {
      "institution": "",
      "country": "",
      "department": "",
      "area": "",
      "studyType": "",
      "studyMode": "",
      "degree": "",
      "primaryDiscipline": "",
      "startDate": "",
      "endDate": "",
      "gpa": "",
      "ranking": "",
      "studentCadre": "",
      "courses": [],
      "schoolExperience": "",
      "scholarships": "",
      "lab": "",
      "advisor": "",
      "thesis": ""
    }
  ],
  "internship": [
    {
      "company": "",
      "position": "",
      "startDate": "",
      "endDate": "",
      "endDateFallback": "",
      "workType": "",
      "summary": "",
      "summaryShort": "",
      "responsibilities": "",
      "deliverables": "",
      "outcomes": "",
      "department": "",
      "location": "",
      "isPresent": false,
      "highlights": [],
      "leaveReason": "",
      "currentSalary": ""
    }
  ],
  "work": [
    {
      "company": "",
      "position": "",
      "startDate": "",
      "endDate": "",
      "endDateFallback": "",
      "summary": "",
      "summaryShort": "",
      "responsibilities": "",
      "deliverables": "",
      "outcomes": "",
      "department": "",
      "location": "",
      "isPresent": false,
      "highlights": [],
      "leaveReason": "",
      "currentSalary": ""
    }
  ],
  "projects": [],
  "publications": [],
  "skills": [
    {
      "name": "编程语言",
      "items": [
        { "skill": "", "level": "" }
      ]
    }
  ],
  "languages": [
    {
      "language": "",
      "fluency": ""
    }
  ],
  "certificates": [],
  "awards": [],
  "patents": [],
  "family": [],
  "campusPractice": [],
  "training": [],
  "interests": []
}
